Attraction,Event Name,Location (District/Place),Province No.,Venue,Month / Season,Duration,Type,Description / Source
Tin Tale Waterfall,Tin Tale Eco & Cultural Day,Kavre,3,Waterfall / Hill,Summer,1 day,Eco / Cultural,Folk performances and environmental awareness.
Manikhel,Manikhel Village Cultural Festival,Kavre,3,Village Grounds,Autumn,1 day,Cultural,"Folk music, dances, and handicraft stalls."
Kalanti,Kalanti Highland Eco & Cultural Trek,Kavre,3,Hill / Village,Spring,1 day,Adventure / Eco,Trekking and folk performances.
Malpi,Malpi Village Cultural Festival,Kavre,3,Village Grounds,Autumn,1 day,Cultural,"Folk performances, music, and handicrafts."
KapalKot,KapalKot Highland Cultural Festival,Rasuwa,3,Hill / Village,Summer,1 day,Cultural,"Trekking, folk performances, and handicraft exhibitions."
Mahendrajyoti,Mahendrajyoti Highland Eco & Cultural Day,Kavre,3,Hill / Village,Spring,1 day,Eco / Cultural,"Trekking, folk performances, and environmental awareness."
Baramchi,Baramchi Village Cultural Festival,Rasuwa,3,Village Grounds,Autumn,1 day,Cultural,"Folk music, dances, and handicrafts."
Mankha,Mankha Highland Eco & Cultural Day,Rasuwa,3,Hill / Village,Summer,1 day,Eco / Cultural,Trekking and local folk performances.
Maneshwor,Maneshwor Temple Mela,Kathmandu,3,Temple Grounds,March,1 day,Religious / Cultural,Devotional rituals and folk performances.
Yalmu Waterfall,Yalmu Waterfall Eco & Cultural Day,Rasuwa,3,Waterfall / Hill,Summer,1 day,Eco / Cultural,"Trekking, folk performances, and environmental awareness."
Gathi,Gathi Highland Cultural Festival,Rasuwa,3,Village Grounds,Autumn,1 day,Cultural,"Folk music, dances, and handicrafts."
Marming,Marming Village Eco & Cultural Trek,Rasuwa,3,Hill / Village,Spring,1 day,Adventure / Eco,Trekking and folk performances.
Dhuskun,Dhuskun Highland Eco & Cultural Day,Rasuwa,3,Hill / Village,Summer,1 day,Eco / Cultural,"Trekking, folk performances, and environmental awareness."
Chaukati,Chaukati Village Cultural Festival,Kavre,3,Village Grounds,Autumn,1 day,Cultural,"Folk music, dances, and handicrafts."
Ghorthali,Ghorthali Highland Cultural Day,Rasuwa,3,Village Grounds,Spring,1 day,Cultural,Folk performances and handicraft exhibitions.
Bigu,Bigu Highland Eco & Cultural Trek,Rasuwa,3,Trek / Village,Summer,2 days,Adventure / Cultural,Trekking and local folk performances.
Deudhunga Dada,Deudhunga Dada Highland Cultural Festival,Rasuwa,3,Hill / Village,Autumn,1 day,Cultural,Trekking and folk performances.
Seti Mata,Seti Mata Temple Mela,Rasuwa,3,Temple Grounds,March,1 day,Religious / Cultural,Devotional rituals with folk performances.
Kalinchowk Bhagawati Temple,Kalinchowk Bhagawati Temple Mela,Dolakha,3,Temple Grounds,May,1 day,Religious / Cultural,"Devotional rituals, local folk dances, and handicraft stalls."
Gairabari,Gairabari Highland Cultural Day,Rasuwa,3,Hill / Village,Spring,1 day,Cultural,Folk performances and handicrafts.
Betechhap,Betechhap Highland Trek & Cultural Day,Rasuwa,3,Trek / Hill,Summer,1 day,Adventure / Cultural,Trekking with local folk performances.
Lisankhu,Lisankhu Village Cultural Festival,Rasuwa,3,Village Grounds,Autumn,1 day,Cultural,Folk performances and handicrafts.
Attarpur,Attarpur Highland Eco & Cultural Day,Rasuwa,3,Hill / Village,Spring,1 day,Eco / Cultural,"Trekking, folk performances, and environmental awareness."
Baghkhor,Baghkhor Village Cultural Festival,Rasuwa,3,Village Grounds,Autumn,1 day,Cultural,"Folk music, dances, and handicraft stalls."
Aahaldanda,Aahaldanda Highland Trek & Cultural Festival,Rasuwa,3,Hill / Village,Summer,1 day,Adventure / Cultural,Trekking with folk performances.
Jiri,Jiri Highland Eco & Cultural Trek,Dolakha / Ramechhap,3,Trek / Village,Spring,2 days,Adventure / Cultural,"Trekking, folk performances, and handicraft exhibitions."
Chuchure,Chuchure Village Cultural Day,Lalitpur,3,Village Grounds,Spring,1 day,Cultural,"Folk music, dances, and local handicraft exhibition."
Harisiddhi,Harisiddhi Temple Festival,Lalitpur,3,Temple Grounds,March,1 day,Religious / Cultural,"Devotional rituals, folk performances, and community gathering."
Siddhipur,Siddhipur Heritage Festival,Lalitpur,3,Village Streets,Autumn,2 days,Cultural / Heritage,"Newari folk dances, handicraft fair, and traditional food exhibition."
Lubhu,Lubhu Cultural & Heritage Fair,Lalitpur,3,Village Grounds,Spring,1 day,Cultural,"Folk performances, traditional Newari rituals, and handicraft stalls."
Dadhikot,Dadhikot Highland Eco & Cultural Day,Bhaktapur,3,Hill / Village,Summer,1 day,Adventure / Cultural,"Trekking, folk performances, and environmental awareness."
Gundu Chaur,Gundu Chaur Village Cultural Festival,Kavre,3,Village Grounds,Autumn,1 day,Cultural,"Folk music, dances, and handicrafts."
Ranikot,Ranikot Highland Trek & Cultural Day,Kavre,3,Hill / Village,Spring,1 day,Adventure / Cultural,Trekking combined with local folk performances.
Sirandada,Sirandada Highland Eco & Cultural Day,Kavre,3,Hill / Village,Summer,1 day,Eco / Cultural,Trekking and environmental awareness with folk performances.
Ghyampe Danda,Ghyampe Danda Village Festival,Kavre,3,Hill / Village Grounds,Autumn,1 day,Cultural,"Folk music, dances, and handicraft exhibitions."
Nangkhel,Nangkhel Highland Trek & Cultural Festival,Kavre,3,Hill / Village,Spring,1 day,Adventure / Cultural,Trekking and local folk performances.
Bhainsepati,Bhainsepati Cultural Heritage Day,Lalitpur,3,Village Grounds,Autumn,1 day,Cultural,"Folk music, dances, and handicrafts."
Dhunkharka,Dhunkharka Highland Eco & Cultural Trek,Kavre,3,Hill / Village,Summer,1 day,Adventure / Eco,"Trekking, folk performances, and environmental awareness."
Tindhare Jharana,Tindhare Waterfall Eco Festival,Kavre,3,Waterfall / Hill,Summer,1 day,Eco / Cultural,Folk performances and environmental awareness at waterfall.
Patlekhet,Patlekhet Highland Cultural Festival,Kavre,3,Village Grounds,Spring,1 day,Cultural,"Folk music, dances, and handicraft stalls."
TinPiple,TinPiple Highland Trek & Cultural Day,Kavre,3,Hill / Village,Autumn,1 day,Adventure / Cultural,Trekking and folk performances.
Dulalthok,Dulalthok Eco & Cultural Day,Kavre,3,Hill / Village,Summer,1 day,Eco / Cultural,Environmental awareness combined with local folk performances.
Panchkhal,Panchkhal Highland Cultural Festival,Kavre,3,Village Grounds,Spring,1 day,Cultural,"Folk performances, dances, and handicraft exhibitions."
Jyamdi Mandan,Jyamdi Mandan Village Cultural Day,Kavre,3,Village Grounds,Autumn,1 day,Cultural,"Folk music, dances, and handicrafts."
Phalante,Phalante Highland Eco & Cultural Day,Kavre,3,Hill / Village,Summer,1 day,Eco / Cultural,Trekking and local folk performances.
Panichaur,Panichaur Village Cultural Festival,Kavre,3,Village Grounds,Spring,1 day,Cultural,"Folk music, dances, and handicraft stalls."
Bethan,Bethan Highland Eco & Cultural Trek,Kavre,3,Hill / Village,Summer,1 day,Adventure / Eco,Trekking and environmental awareness with folk performances.
Madan Kundari,Madan Kundari Village Cultural Festival,Kavre,3,Village Grounds,Autumn,1 day,Cultural,"Folk performances, dances, and handicraft exhibitions."
Gunsi Bhadaure,Gunsi Bhadaure Highland Trek & Cultural Day,Rasuwa,3,Hill / Village,Spring,1 day,Adventure / Cultural,Trekking and local folk performances.
Tokarpur,Tokarpur Village Cultural Festival,Kavre,3,Village Grounds,Summer,1 day,Cultural,"Folk music, dances, and handicrafts."
Katakuti,Katakuti Highland Eco & Cultural Day,Kavre,3,Hill / Village,Autumn,1 day,Eco / Cultural,Folk performances combined with environmental awareness.
Bhusapheda,Bhusapheda Highland Cultural Festival,Kavre,3,Village Grounds,Spring,1 day,Cultural,"Folk music, dances, and handicrafts."
Marming,Marming Highland Eco & Cultural Trek,Rasuwa,3,Hill / Village,Summer,1 day,Adventure / Eco,Trekking and local folk performances.
Tauthali,Tauthali Village Cultural Festival,Kavre,3,Village Grounds,Autumn,1 day,Cultural,"Folk music, dances, and handicraft stalls."
Piskar,Piskar Highland Eco & Cultural Day,Rasuwa,3,Hill / Village,Spring,1 day,Eco / Cultural,"Trekking, folk performances, and environmental awareness."
Kharidhunga,Kharidhunga Highland Trek & Cultural Festival,Rasuwa,3,Hill / Village,Summer,1 day,Adventure / Cultural,Trekking and local folk performances.
Nalang,Nalang Village Cultural Festival,Dhading,3,Village Grounds,Autumn,1 day,Cultural,"Folk music, dances, and handicrafts."
Bungchung,Bungchung Highland Eco & Cultural Day,Rasuwa,3,Hill / Village,Spring,1 day,Eco / Cultural,Trekking and folk performances.
Dovantar,Dovantar Village Cultural Festival,Kavre,3,Village Grounds,Summer,1 day,Cultural,"Folk music, dances, and handicrafts."
Sasaha,Sasaha Highland Trek & Cultural Day,Rasuwa,3,Hill / Village,Autumn,1 day,Adventure / Cultural,Trekking and local folk performances.
Murali Bhanjyang,Murali Bhanjyang Eco & Cultural Day,Rasuwa,3,Hill / Village,Spring,1 day,Eco / Cultural,"Trekking, folk performances, and environmental awareness."
Aansi Khola Motorable Bridge,Aansi Khola Bridge Cultural Festival,Kavre,3,Bridge Area / Hill,Summer,1 day,Cultural,Folk performances and community gathering.
Sunkhani,Sunkhani Highland Eco & Cultural Trek,Kavre,3,Hill / Village,Autumn,1 day,Adventure / Eco,Trekking and local folk performances.
Golabhanjyang,Golabhanjyang Village Cultural Festival,Rasuwa,3,Village Grounds,Spring,1 day,Cultural,"Folk music, dances, and handicrafts."
Jyamrung,Jyamrung Highland Trek & Cultural Day,Dhading,3,Hill / Village,Summer,1 day,Adventure / Cultural,Trekking and local folk performances.
Katunge,Katunge Village Cultural Festival,Kavre,3,Village Grounds,Autumn,1 day,Cultural,"Folk music, dances, and handicrafts."
Phulkharka,Phulkharka Highland Eco & Cultural Day,Rasuwa,3,Hill / Village,Spring,1 day,Eco / Cultural,"Trekking, folk performances, and environmental awareness."
Budhathum,Budhathum Village Cultural Festival,Dhading,3,Village Grounds,Summer,1 day,Cultural,"Folk music, dances, and handicrafts."
Mulpani,Mulpani Highland Eco & Cultural Trek,Kavre,3,Hill / Village,Autumn,1 day,Adventure / Eco,Trekking and local folk performances.
Sangkosh,Sangkosh Village Cultural Festival,Dhading,3,Village Grounds,Spring,1 day,Cultural,Folk performances and handicrafts.
Sertung,Sertung Highland Eco & Cultural Day,Rasuwa,3,Hill / Village,Summer,1 day,Eco / Cultural,"Trekking, folk performances, and environmental awareness."
Babil Waterfall,Babil Waterfall Eco Festival,Rasuwa,3,Waterfall / Hill,Summer,1 day,Eco / Cultural,Folk performances and environmental awareness at waterfall.
Borang,Borang Village Cultural Festival,Rasuwa,3,Village Grounds,Autumn,1 day,Cultural,"Folk music, dances, and handicrafts."
Kalo Daha Mhane,Kalo Daha Eco & Cultural Day,Kavre,3,Hill / Waterfall,Spring,1 day,Eco / Cultural,"Trekking, folk performances, and environmental awareness."
Pusu Wala Kharka,Pusu Wala Highland Cultural Festival,Rasuwa,3,Hill / Village,Summer,1 day,Cultural,Trekking and local folk performances.
Pabil,Pabil Village Cultural Festival,Rasuwa,3,Village Grounds,Autumn,1 day,Cultural,"Folk music, dances, and handicrafts."
Dhunche,Dhunche Highland Eco & Cultural Trek,Rasuwa,3,Hill / Village,Spring,2 days,Adventure / Eco,"Trekking, folk performances, and environmental awareness."
Chandanbari,Chandanbari Village Cultural Festival,Dhading,3,Village Grounds,Summer,1 day,Cultural,"Folk music, dances, and handicrafts."
Lauri Binayak,Lauri Binayak Highland Eco & Cultural Day,Kavre,3,Hill / Village,Autumn,1 day,Eco / Cultural,"Trekking, folk performances, and environmental awareness."
Gaunkharka,Gaunkharka Village Cultural Festival,Rasuwa,3,Village Grounds,Spring,1 day,Cultural,Folk performances and handicrafts.
Sursing Waterfall,Sursing Waterfall Eco & Cultural Day,Rasuwa,3,Waterfall / Hill,Summer,1 day,Eco / Cultural,Folk performances and environmental awareness.
MaginGoth,MaginGoth Highland Cultural Festival,Rasuwa,3,Hill / Village,Autumn,1 day,Cultural,Trekking and folk performances.
Thakani,Thakani Village Cultural Festival,Dhading,3,Village Grounds,Spring,1 day,Cultural,"Folk music, dances, and handicrafts."
Talramarang,Talramarang Highland Eco & Cultural Trek,Rasuwa,3,Hill / Village,Summer,1 day,Adventure / Eco,Trekking and folk performances.
Dubachaur,Dubachaur Village Cultural Festival,Dhading,3,Village Grounds,Autumn,1 day,Cultural,"Folk performances, music, and handicrafts."
Tipeni,Tipeni Highland Eco & Cultural Trek,Rasuwa,3,Hill / Village,Spring,1 day,Adventure / Eco,"Trekking, folk performances, and environmental awareness."
Sikharpur,Sikharpur Village Cultural Festival,Rasuwa,3,Village Grounds,Summer,1 day,Cultural,"Folk music, dances, and handicrafts."
Dolalghat,Dolalghat Highland Cultural Trek,Kavre,3,Hill / Village,Spring,1 day,Adventure / Cultural,Trekking with local folk performances and handicraft exhibition.
Phalate Bhumlu,Phalate Bhumlu Village Cultural Festival,Kavre,3,Village Grounds,Summer,1 day,Cultural,"Folk music, traditional dances, and local cuisine exhibition."
Chaubas,Chaubas Highland Eco & Cultural Day,Dhading,3,Hill / Village,Autumn,1 day,Eco / Cultural,"Trekking, folk performances, and environmental awareness."
Sanowangthali,Sanowangthali Village Cultural Festival,Dhading,3,Village Grounds,Spring,1 day,Cultural,"Folk music, dances, and handicrafts."
Bangthali,Bangthali Highland Eco & Cultural Trek,Sindhupalchok,3,Hill / Village,Summer,1 day,Adventure / Eco,"Trekking, folk performances, and environmental awareness."
Dhumthang,Dhumthang Village Cultural Festival,Sindhupalchok,3,Village Grounds,Autumn,1 day,Cultural,"Folk music, dances, and handicraft stalls."
Nitya Chandeshwor,Nitya Chandeshwor Temple Festival,Kavre,3,Temple Grounds,March,1 day,Religious / Cultural,Devotional rituals and folk performances.
Mahendrajyoti,Mahendrajyoti Highland Cultural Day,Kavre,3,Hill / Village,Spring,1 day,Cultural,"Folk music, dances, and handicrafts."
Gairi Gaun,Gairi Gaun Village Cultural Festival,Kavre,3,Village Grounds,Summer,1 day,Cultural,"Folk music, dances, and local handicraft stalls."
Kursi Dada,Kursi Dada Highland Eco & Cultural Trek,Kavre,3,Hill / Village,Autumn,1 day,Adventure / Eco,Trekking and local folk performances.
Batase Dada,Batase Dada Village Cultural Festival,Dhading,3,Hill / Village,Spring,1 day,Cultural,"Folk music, dances, and handicrafts."
Rolling Batase Hills,Rolling Batase Highland Trek & Cultural Day,Dhading,3,Hill / Village,Summer,1 day,Adventure / Cultural,Trekking and folk performances.
Judlee,Judlee Village Cultural Festival,Dhading,3,Village Grounds,Autumn,1 day,Cultural,"Folk music, dances, and handicraft stalls."
Thadobato,Thadobato Highland Eco & Cultural Day,Kavre,3,Hill / Village,Spring,1 day,Eco / Cultural,Trekking and local folk performances.
Fulchoki Mandir (Basnet Gau),Fulchoki Temple Festival,Lalitpur,3,Temple Grounds,March,1 day,Religious / Cultural,Devotional rituals and cultural performances.
Sansari Devi Temple,Sansari Devi Temple Mela,Kavre,3,Temple Grounds,April,1 day,Religious / Cultural,"Rituals, folk dances, and community gathering."
Dhaneshwor,Dhaneshwor Village Cultural Festival,Kavre,3,Village Grounds,Summer,1 day,Cultural,"Folk music, dances, and handicrafts."
Nagai Dhunga,Nagai Dhunga Highland Eco & Cultural Trek,Kavre,3,Hill / Village,Autumn,1 day,Adventure / Eco,Trekking and local folk performances.
Dhaneshwor Mahadev Temple,Dhaneshwor Mahadev Temple Festival,Kavre,3,Temple Grounds,March,1 day,Religious / Cultural,"Devotional rituals, folk dances, and local fair."
Bogati Gaun,Bogati Village Cultural Festival,Lalitpur,3,Village Grounds,Spring,1 day,Cultural,"Folk music, dances, and handicrafts."
Shreekhandpur,Shreekhandpur Highland Eco & Cultural Day,Kavre,3,Hill / Village,Summer,1 day,Eco / Cultural,"Trekking, folk performances, and environmental awareness."
Devisthan (Laa Than Pata),Devisthan Village Cultural Festival,Kavre,3,Temple / Village Grounds,Autumn,1 day,Cultural / Religious,Folk performances and religious rituals.
Shrikhandapur Bindhabasini Temple,Bindhabasini Temple Festival,Kavre,3,Temple Grounds,March,1 day,Religious / Cultural,"Devotional rituals, folk performances, and local fair."
Salle Panuati,Salle Panuati Village Cultural Festival,Kavre,3,Village Grounds,Spring,1 day,Cultural,"Folk music, dances, and handicraft stalls."
Talu Dadha,Talu Dadha Highland Eco & Cultural Trek,Kavre,3,Hill / Village,Summer,1 day,Adventure / Eco,Trekking and folk performances.
Chature Village,Chature Village Cultural Festival,Kavre,3,Village Grounds,Autumn,1 day,Cultural,Folk performances and handicrafts.
Lukeko Dada,Lukeko Dada Highland Eco & Cultural Trek,Kavre,3,Hill / Village,Spring,1 day,Adventure / Eco,Trekking and folk performances.
Ashapuri Mahadev,Ashapuri Mahadev Temple Festival,Lalitpur,3,Temple Grounds,March,1 day,Religious / Cultural,Devotional rituals and folk dances.
Dhad Gaun,Dhad Gaun Village Cultural Festival,Kavre,3,Village Grounds,Summer,1 day,Cultural,"Folk music, dances, and handicraft stalls."
Seti Devi,Seti Devi Temple Festival,Kavre,3,Temple Grounds,April,1 day,Religious / Cultural,Devotional rituals and folk performances.
Kotthumka,Kotthumka Village Cultural Festival,Kavre,3,Village Grounds,Spring,1 day,Cultural,"Folk music, dances, and handicrafts."
Raut Gaun,Raut Gaun Highland Eco & Cultural Day,Kavre,3,Hill / Village,Summer,1 day,Eco / Cultural,Trekking and local folk performances.
Chittapol,Chittapol Village Cultural Festival,Kavre,3,Village Grounds,Autumn,1 day,Cultural,"Folk music, dances, and handicrafts."
Soche,Soche Highland Eco & Cultural Trek,Kavre,3,Hill / Village,Spring,1 day,Adventure / Eco,Trekking and folk performances.
Kakhbari,Kakhbari Village Cultural Festival,Kavre,3,Village Grounds,Summer,1 day,Cultural,"Folk music, dances, and handicrafts."
Bairikhel,Bairikhel Highland Eco & Cultural Trek,Kavre,3,Hill / Village,Autumn,1 day,Adventure / Eco,Trekking and local folk performances.
Ghyampe Danda Mountain Bike Trails,Ghyampe Danda MTB Cultural Day,Kavre,3,Hill / Trail,Summer,1 day,Adventure / Cultural,Mountain biking combined with folk performances.
Pilot Baba Ashram,Pilot Baba Ashram Festival,Lalitpur,3,Ashram Grounds,March,1 day,Religious / Cultural,Devotional rituals and cultural performances.
Field of Green,Field of Green Eco & Cultural Day,Kavre,3,Hill / Field,Spring,1 day,Eco / Cultural,Environmental awareness and folk performances.
Tarakeshwor Mahadev Temple,Tarakeshwor Mahadev Temple Festival,Kathmandu,3,Temple Grounds,March,1 day,Religious / Cultural,"Devotional rituals, folk dances, and local fair."
Samakhusi,Samakhusi Village Cultural Day,Kathmandu,3,Village Grounds,Autumn,1 day,Cultural,Folk performances and handicrafts.
Boharatar,Boharatar Highland Eco & Cultural Trek,Kathmandu,3,Hill / Village,Summer,1 day,Adventure / Eco,Trekking and folk performances.
Jamacho Gumba,Jamacho Gumba Monastery Festival,Kavre,3,Monastery Grounds,April,1 day,Religious / Cultural,Buddhist rituals and folk performances.
Ichangunarayan,Ichangunarayan Temple Festival,Bhaktapur,3,Temple Grounds,March,1 day,Religious / Cultural,Devotional rituals and local folk performances.
Mudkhu,Mudkhu Highland Eco & Cultural Trek,Kavre,3,Hill / Village,Spring,1 day,Adventure / Eco,"Trekking, folk performances, and environmental awareness."
Bhubaneshwori Temple,Bhubaneshwori Temple Festival,Kathmandu,3,Temple Grounds,March,1 day,Religious / Cultural,Devotional rituals and folk performances.
Okharpauwa,Okharpauwa Highland Eco & Cultural Trek,Nuwakot,3,Hill / Village,Summer,1 day,Adventure / Eco,Trekking and folk performances.
Kakani,Kakani Highland Trek & Cultural Festival,Nuwakot,3,Hill / Village,Spring,1 day,Adventure / Cultural,Trekking and local folk performances.
Lauke Waterfall,Lauke Waterfall Eco Festival,Nuwakot,3,Waterfall / Hill,Summer,1 day,Eco / Cultural,Folk performances and environmental awareness.
Nuwakot,Nuwakot Palace Heritage Festival,Nuwakot,3,Palace Grounds,Autumn,2 days,Heritage / Cultural,"Folk performances, historical exhibitions, and handicrafts."
Bidur,Bidur Village Cultural Festival,Nuwakot,3,Village Grounds,Spring,1 day,Cultural,"Folk music, dances, and handicrafts."
Duipipal,Duipipal Highland Eco & Cultural Trek,Nuwakot,3,Hill / Village,Summer,1 day,Adventure / Eco,Trekking and folk performances.
Chepang Gaun,Chepang Village Cultural Festival,Dhading,3,Village Grounds,Autumn,1 day,Cultural,Folk performances and handicrafts.
Baglung Bazaar,Baglung Bazaar Cultural Fair,Baglung,4,Bazaar / Town Square,Spring,2 days,Cultural / Trade,Folk performances and local handicraft exhibitions.
Panchakot,Panchakot Highland Eco & Cultural Day,Baglung,4,Hill / Village,Summer,1 day,Adventure / Eco,Trekking and folk performances.
Bihun,Bihun Village Cultural Festival,Baglung,4,Village Grounds,Autumn,1 day,Cultural,"Folk music, dances, and handicrafts."
Nishi,Nishi Highland Eco & Cultural Trek,Baglung,4,Hill / Village,Spring,1 day,Adventure / Eco,Trekking and local folk performances.
Bhakunde,Bhakunde Village Cultural Festival,Baglung,4,Village Grounds,Summer,1 day,Cultural,"Folk performances, dances, and handicrafts."
Arthar Dandakharka,Arthar Dandakharka Highland Eco & Cultural Trek,Baglung,4,Hill / Village,Autumn,1 day,Adventure / Eco,Trekking and folk performances.
Lekhphant,Lekhphant Village Cultural Festival,Baglung,4,Village Grounds,Spring,1 day,Cultural,"Folk music, dances, and handicrafts."
Kusma,Kusma Bazaar Heritage & Cultural Fair,Parbat,4,Bazaar / Town Square,Summer,2 days,Heritage / Cultural,"Folk performances, handicraft exhibitions, and local cuisine."
Pokhara,Pokhara Lakeside Cultural Festival,Kaski,4,Lakeside Grounds,Autumn,3 days,Cultural / Tourism,"Folk dances, music performances, and local handicrafts."
Sarangkot,Sarangkot Highland Eco & Cultural Trek,Kaski,4,Hill / Viewpoint,Spring,1 day,Adventure / Eco,Trekking and local folk performances.
Ghandruk,Ghandruk Village Cultural Festival,Kaski,4,Village Grounds,Summer,2 days,Cultural,"Folk performances, handicrafts, and traditional food exhibition."
Dhampus,Dhampus Highland Eco & Cultural Trek,Kaski,4,Hill / Village,Spring,1 day,Adventure / Eco,Trekking and folk performances.
Lwang Ghalel,Lwang Ghalel Village Cultural Festival,Kaski,4,Village Grounds,Autumn,1 day,Cultural,"Folk music, dances, and handicrafts."
Ghale Gaun,Ghale Gaun Highland Eco & Cultural Day,Kaski,4,Hill / Village,Summer,1 day,Adventure / Cultural,Trekking and local folk performances.
Bhujung,Bhujung Highland Eco & Cultural Trek,Lamjung,4,Hill / Village,Spring,1 day,Adventure / Cultural,Trekking with local folk dances and handicrafts exhibition.
Rainaskot,Rainaskot Village Cultural Festival,Lamjung,4,Village Grounds,Summer,1 day,Cultural,"Folk music, dances, and local handicraft stalls."
Lamjung Himal Viewpoint,Lamjung Himal Viewpoint Trek & Festival,Lamjung,4,Viewpoint,Autumn,1 day,Adventure / Eco,Trekking with environmental awareness and folk performances.
Gorkha Bazaar,Gorkha Bazaar Cultural Fair,Gorkha,4,Bazaar / Town Square,Winter,2 days,Cultural / Trade,"Local crafts, folk performances, and cuisine exhibition."
Manakamana,Manakamana Temple Festival,Gorkha,4,Temple Grounds,March,1 day,Religious / Cultural,Devotional rituals with folk dances and community fair.
Barpak,Barpak Highland Cultural Trek,Gorkha,4,Hill / Village,Spring,1 day,Adventure / Cultural,"Trekking, folk performances, and handicraft display."
Laprak,Laprak Village Cultural Festival,Gorkha,4,Village Grounds,Summer,1 day,Cultural,"Folk music, dances, and local handicrafts."
Manang Bazaar,Manang Highland Cultural Festival,Manang,4,Bazaar / Village,Autumn,1 day,Cultural / Adventure,Folk performances and trekking with cultural storytelling.
Braga,Braga Village Cultural Festival,Manang,4,Village Grounds,Spring,1 day,Cultural,"Folk dances, handicraft stalls, and traditional music."
Khangsar,Khangsar Highland Eco Trek & Cultural Day,Manang,4,Hill / Village,Summer,1 day,Adventure / Eco,"Trekking, environmental awareness, and folk performances."
Jomsom,Jomsom Mountain Cultural Festival,Mustang,4,Bazaar / Village,Autumn,2 days,Cultural / Adventure,"Folk performances, local handicrafts, and trekking events."
Lo Manthang,Lo Manthang Traditional Cultural Festival,Mustang,4,Village / Palace Grounds,Spring,2 days,Heritage / Cultural,Mustang royal heritage fair with folk dances and handicrafts.
Muktinath,Muktinath Temple Festival,Mustang,4,Temple Grounds,January,1 day,Religious / Cultural,"Devotional rituals, folk performances, and local fair."
Kagbeni,Kagbeni Village Cultural Day,Mustang,4,Village Grounds,Summer,1 day,Cultural,"Folk music, traditional dances, and handicraft stalls."
Marpha,Marpha Apple & Cultural Festival,Mustang,4,Village / Orchard,Autumn,2 days,Cultural / Trade,Apple harvest festival with folk dances and handicraft exhibition.
Beni Bazaar,Beni Bazaar Highland Cultural Fair,Myagdi,4,Bazaar / Town Square,Spring,2 days,Cultural / Trade,"Folk performances, local handicrafts, and food stalls."
Tatopani,Tatopani Hot Springs Cultural Festival,Myagdi,4,Hot Springs Area,Summer,1 day,Eco / Cultural,Folk performances and wellness tourism awareness.
Babiyachaur,Babiyachaur Village Cultural Festival,Myagdi,4,Village Grounds,Autumn,1 day,Cultural,"Folk music, dances, and handicraft stalls."
Dhorpatan,Dhorpatan Highland Eco & Cultural Trek,Baglung,4,Hill / Village,Spring,1 day,Adventure / Eco,Trekking with local folk performances and handicrafts.
Devghat,Devghat Religious & Cultural Festival,Nawalparasi,4,Temple Grounds,January,2 days,Religious / Cultural,Rituals at confluence of rivers with folk dances.
Kawasoti,Kawasoti Village Cultural Fair,Nawalparasi,4,Village Grounds,Summer,1 day,Cultural,"Folk music, traditional dances, and handicraft stalls."
Hupsekot,Hupsekot Highland Eco & Cultural Trek,Nawalparasi,4,Hill / Village,Spring,1 day,Adventure / Eco,Trekking and local cultural performances.
Bandipur,Bandipur Heritage & Cultural Festival,Tanahun,4,Bazaar / Hilltop,Autumn,2 days,Heritage / Cultural,"Folk performances, local handicrafts, and traditional cuisine."
