Attraction,Event Name,Location (District/Place),Province No.,Venue,Month / Season,Duration,Type,Description / Source
Bharatpur,Bharatpur Eco & Cultural Week,Chitwan,3,Park / Community Grounds,Winter,3 days,Eco / Cultural,"Wildlife awareness, folk performances, and local crafts."
Jayamangala (Ratnanagar area),Jayamangala Cultural & Trade Fair,Chitwan,3,Village / Market Area,Autumn,2 days,Cultural / Trade,Local trade exhibition with folk performances and handicrafts.
Krishna Pranami Temple,Krishna Pranami Temple Mela,Chitwan,3,Temple Premises,February,1 day,Religious,Devotional rituals with community performances.
Panchakanya Mandir,Panchakanya Mandir Festival,Chitwan,3,Temple Grounds,March,1 day,Religious / Cultural,"Folk performances, temple rituals, and local food stalls."
Chisapani Mandir,Chisapani Temple Mela,Nuwakot,3,Temple Grounds,Spring,1 day,Religious,Pilgrimage rituals with local folk performances.
Ratnanagar,Ratnanagar Cultural & Trade Fair,Chitwan,3,Market Area,Autumn,2 days,Cultural / Trade,"Folk music, handicrafts, and trade exhibitions."
Khairahani,Khairahani Village Festival,Chitwan,3,Village Ground,Autumn,1 day,Cultural,"Folk performances, music, and local food."
Korak,Korak Cultural Day,Chitwan,3,Village Ground,Spring,1 day,Cultural,Community gathering with folk performances and handicraft stalls.
Bandipur,Bandipur Cultural & Heritage Week,Tanahun,3,Village / Town Square,Autumn,2 days,Cultural / Tourism,"Folk performances, heritage tours, and handicraft exhibitions."
Nilkantha,Nilkantha Highland Eco & Adventure Day,Dhading,3,Hill / Village Grounds,Spring,1 day,Eco / Adventure,"Trekking, environmental awareness, and local folk performances."
Dhuwakot,Dhuwakot Village Festival,Dhading,3,Village Square,Autumn,1 day,Cultural,"Folk dances, music, and handicraft exhibitions."
Deurali Danda,Deurali Danda Trekking & Cultural Day,Dhading,3,Hilltop / Trail,Summer,1 day,Adventure / Cultural,Trekking with folk performances and environmental awareness.
Vagerachuli,Vagerachuli Eco & Cultural Trek,Dhading,3,Hill Area,Spring,1 day,Eco / Adventure,"Trekking, biodiversity awareness, and cultural performances."
Semjong,Semjong Village Festival,Dhading,3,Village Grounds,Autumn,1 day,Cultural,"Folk music, dances, and local crafts showcase."
Barsunchet,Barsunchet Heritage & Eco Day,Dhading,3,Village / Hilltop,Spring,1 day,Cultural / Eco,Local heritage and environmental awareness combined with folk performances.
Bungtang,Bungtang Adventure & Cultural Trek,Dhading,3,Village / Hill Trail,Autumn,2 days,Adventure / Cultural,"Trekking, folk performances, and handicraft exhibitions."
Deurali,Deurali Highland Eco & Trekking Festival,Dhading,3,Trek Base,Summer,1 day,Eco / Adventure,Trekking and environmental awareness with local folk programs.
Tupche,Tupche Cultural Day,Dhading,3,Village Ground,Autumn,1 day,Cultural,"Folk dances, music, and handicraft exhibitions."
Chappthoke,Chappthoke Trek & Culture Festival,Dhading,3,Trek / Village,Spring,1 day,Adventure / Cultural,Trekking and local cultural performances.
Pokhari Gaun,Pokhari Gaun Heritage & Folk Festival,Dhading,3,Village Grounds,Autumn,1 day,Cultural,"Folk dances, traditional music, and handicraft stalls."
Champani Gaun,Champani Gaun Cultural & Adventure Day,Dhading,3,Village / Hill,Spring,1 day,Cultural / Adventure,Trekking with folk performances and environmental awareness.
Yarsa,Yarsa Highland Cultural Festival,Dhading,3,Hill / Village,Summer,1 day,Cultural,"Folk music, dances, and handicraft exhibition."
Urleni (Helambu area),Urleni Helambu Cultural Trek,Sindhupalchok,3,Trek Base / Village,Autumn,2 days,Adventure / Cultural,Trekking and local Limbu culture performances.
Shikharbesi (Nuwakot),Shikharbesi Eco & Trekking Day,Nuwakot,3,Village / Trek Area,Spring,1 day,Adventure / Eco,Trekking with environmental awareness and local folk programs.
Ghyangphedi,Ghyangphedi Highland Festival,Sindhupalchok,3,Village / Hilltop,Summer,1 day,Cultural / Adventure,"Folk dances, trekking, and handicrafts."
Helambu,Helambu Cultural Trekking Festival,Sindhupalchok,3,Trek / Villages,Autumn,3 days,Adventure / Cultural,"Trekking, local culture, and handicraft exhibitions."
Bhotang,Bhotang Highland Cultural Day,Sindhupalchok,3,Village Grounds,Autumn,1 day,Cultural,"Folk music, dances, and handicraft stalls."
Pachpokhari,Pachpokhari Religious & Eco Day,Sindhupalchok,3,Lake / Shrine Area,Summer,1 day,Religious / Eco,"Pilgrimage rituals, trekking, and environmental awareness."
Phurbi Chyachu,Phurbi Chyachu Trek & Culture Festival,Sindhupalchok,3,Trek Base / Village,Autumn,2 days,Adventure / Cultural,Trekking with folk performances and local crafts.
Tatopani (Sindhupalchok),Tatopani Hot Springs & Cultural Day,Sindhupalchok,3,Hot Springs / Village,Spring,1 day,Eco / Cultural,"Hot spring wellness, folk performances, and handicraft stalls."
Kodari,Kodari Border Cultural Exchange,Sindhupalchok,3,Border Area,Summer,1 day,Cultural / Cross-border,Cultural exchange festival highlighting Nepal–Tibet trade and folk performances.
Phulpingkatti,Phulpingkatti Cultural Trek & Festival,Ramechhap,3,Village / Trek Base,Autumn,1 day,Adventure / Cultural,Trekking with local folk performances and handicraft exhibitions.
Bigu,Bigu Highland Eco & Cultural Day,Ramechhap,3,Village / Hill Area,Spring,1 day,Eco / Cultural,"Trekking, environmental awareness, and folk performances."
Singati,Singati Village Cultural Festival,Ramechhap,3,Village Grounds,Autumn,1 day,Cultural,"Folk dances, music, and handicraft exhibitions."
Suri,Suri Highland Trek & Culture Day,Ramechhap,3,Village / Hill,Summer,1 day,Adventure / Cultural,Trekking with local cultural performances and handicrafts.
Jhyaku,Jhyaku Highland Eco Festival,Ramechhap,3,Hill / Village Grounds,Spring,1 day,Eco / Cultural,Folk performances combined with environmental awareness activities.
Gorpang,Gorpang Adventure & Cultural Trek,Ramechhap,3,Trek Base / Village,Autumn,2 days,Adventure / Cultural,"Trekking, local folk culture, and handicraft exhibitions."
Lamidada,Lamidada Village Festival,Ramechhap,3,Village Square,Summer,1 day,Cultural,"Folk dances, music, and local handicraft stalls."
Jiri,Jiri Himalayan Cultural Trek,Dolakha / Ramechhap,3,Trek Base Camps,Autumn,3 days,Adventure / Cultural,Trekking through remote villages with cultural programs and handicrafts.
Rasnalu,Rasnalu Highland Festival,Ramechhap,3,Village Grounds,Spring,1 day,Cultural,"Folk music, dances, and handicraft exhibitions."
Gupteshwor (Ramechhap),Gupteshwor Temple Festival,Ramechhap,3,Temple Grounds,February,1 day,Religious / Cultural,Devotional rituals with folk performances and local food stalls.
Ramechhap (HQ),Ramechhap Town Cultural Week,Ramechhap,3,Town Square,Autumn,2 days,Cultural / Tourism,"Folk performances, handicraft exhibitions, and local trade stalls."
Rampur (Ramechhap),Rampur Village Festival,Ramechhap,3,Village Grounds,Summer,1 day,Cultural,"Folk dances, music, and local handicraft display."
Himganga,Himganga Highland Eco Day,Ramechhap,3,Hill / Trek Area,Spring,1 day,Eco / Adventure,"Trekking, environmental awareness, and cultural programs."
Melamchi,Melamchi Water & Cultural Festival,Sindhupalchok,3,Riverbank / Village,Monsoon,1 day,Eco / Cultural,Folk performances and environmental awareness on river conservation.
Sipalkavre,Sipalkavre Trek & Cultural Day,Sindhupalchok,3,Hill / Village,Autumn,1 day,Adventure / Cultural,Trekking with local folk dances and handicraft exhibitions.
Chhiku,Chhiku Highland Cultural Festival,Ramechhap,3,Village / Hill,Spring,1 day,Cultural,"Folk music, dances, and local crafts showcase."
Sindurche,Sindurche Eco Trek & Festival,Sindhupalchok,3,Village / Trek Base,Summer,1 day,Adventure / Cultural,Trekking with folk performances and environmental awareness.
Gunsakot,Gunsakot Highland Cultural Trek,Ramechhap,3,Trek / Village Grounds,Autumn,2 days,Adventure / Cultural,Trekking and local folk performances.
Golche,Golche Village Festival,Sindhupalchok,3,Village Grounds,Spring,1 day,Cultural,"Folk music, dances, and handicraft stalls."
Pangtang,Pangtang Highland Eco & Cultural Day,Ramechhap,3,Hill / Village,Summer,1 day,Eco / Cultural,"Trekking, environmental awareness, and local folk programs."
Nampha,Nampha Cultural & Adventure Trek,Ramechhap,3,Trek Base / Village,Autumn,2 days,Adventure / Cultural,Trekking with folk performances and handicrafts.
Budhanilkantha,Budhanilkantha Temple Mela,Kathmandu,3,Temple Grounds,March,1 day,Religious,Devotional rituals with folk performances and community gathering.
Gokarneshwor,Gokarneshwor Temple Festival,Kathmandu,3,Temple Grounds,April,1 day,Religious / Cultural,"Temple rituals, folk performances, and handicrafts."
Bajrayogini Temple,Bajrayogini Temple Annual Festival,Kavre,3,Temple Grounds,October,2 days,Religious / Cultural,"Pilgrimage rituals, folk performances, and local fairs."
Sundarijal Waterfall,Sundarijal Eco Trek & Cultural Day,Kathmandu,3,Waterfall / Trek Area,Summer,1 day,Eco / Adventure,"Trekking, environmental awareness, and folk performances."
Salinadi Temple,Salinadi Temple Festival,Kathmandu,3,Temple Grounds,February,1 day,Religious,Devotional rituals with folk music and local food stalls.
Banepa,Banepa Cultural & Heritage Week,Kavre,3,Town Square / Village Grounds,Autumn,2 days,Cultural / Tourism,"Folk performances, heritage walks, and handicraft stalls."
Dhulikhel,Dhulikhel Yoga & Cultural Festival,Kavre,3,Hilltop / Community Grounds,Spring,1 day,Health / Cultural,"Yoga sessions, folk music, and handicraft stalls."
Namobuddha,Namobuddha Monastery Cultural & Religious Day,Kavre,3,Monastery Grounds,February,1 day,Religious / Cultural,"Pilgrimage rituals, meditation workshops, and folk performances."
Dapcha Chhatrebangh,Dapcha Village Cultural Festival,Kavre,3,Village Grounds,Autumn,1 day,Cultural,"Folk music, dances, and handicraft exhibitions."
Panchkhal,Panchkhal Highland Eco & Cultural Day,Kavre,3,Hilltop / Village Grounds,Spring,1 day,Eco / Cultural,"Trekking, environmental awareness, and folk performances."
Dolalghat,Dolalghat River & Cultural Festival,Kavre,3,Riverbank / Village,Monsoon,1 day,Eco / Cultural,Folk performances and environmental awareness activities.
Phalate (Bhumlu),Phalate Bhumlu Village Cultural Day,Kavre,3,Village Grounds,Autumn,1 day,Cultural,"Folk dances, music, and local handicrafts."
Bhumlutar,Bhumlutar Highland Festival,Kavre,3,Hill / Village Grounds,Spring,1 day,Cultural,"Folk music, dances, and handicraft exhibitions."
Saping,Saping Village Festival,Kavre,3,Village Square,Autumn,1 day,Cultural,"Folk performances, music, and handicraft stalls."
Kalika (Kavre),Kalika Temple Mela,Kavre,3,Temple Grounds,March,1 day,Religious / Cultural,Devotional rituals with folk performances and community gathering.
Sunkhani,Sunkhani Highland Eco & Cultural Trek,Kavre,3,Hill / Trek Area,Spring,1 day,Eco / Adventure,"Trekking, environmental awareness, and folk performances."
Timure,Timure Highland Cultural Festival,Rasuwa,3,Village / Trek Base,Autumn,2 days,Adventure / Cultural,"Trekking, folk performances, and handicraft exhibitions."
Chitlang,Chitlang Heritage & Cultural Festival,Makwanpur,3,Village / Hill,Spring,1 day,Cultural / Tourism,"Folk performances, heritage walks, and local handicrafts."
Markhu,Markhu Eco & Cultural Trek,Kavre,3,Hill / Village Grounds,Summer,1 day,Eco / Cultural,Trekking with environmental awareness and folk performances.
Fakhel,Fakhel Village Cultural Day,Kavre,3,Village Grounds,Autumn,1 day,Cultural,"Folk music, dances, and handicraft exhibitions."
Dakshinkali,Dakshinkali Temple Mela,Kathmandu,3,Temple Grounds,February,1 day,Religious,"Pilgrimage rituals, folk performances, and local food stalls."
Bungamati,Bungamati Heritage & Cultural Festival,Lalitpur,3,Village / Square,Spring,2 days,Cultural / Tourism,"Folk performances, pottery demonstrations, and handicraft stalls."
Chhampi,Chhampi Highland Cultural Festival,Lalitpur,3,Village Grounds,Autumn,1 day,Cultural,"Folk music, dances, and handicraft exhibitions."
Tahakhel,Tahakhel Eco & Cultural Day,Lalitpur,3,Village / Hill,Spring,1 day,Eco / Cultural,Trekking and folk performances with handicraft stalls.
Maneshwor Mahadev Temple,Maneshwor Mahadev Temple Mela,Kathmandu,3,Temple Grounds,March,1 day,Religious / Cultural,Devotional rituals and local folk performances.
Dandagaun,Dandagaun Highland Festival,Kavre,3,Village Grounds,Autumn,1 day,Cultural,"Folk music, dances, and handicraft exhibitions."
Badikhel,Badikhel Village Cultural Day,Lalitpur,3,Village Grounds,Spring,1 day,Cultural,"Folk performances, handicrafts, and community gathering."
Godawari,Godawari Eco & Cultural Festival,Lalitpur,3,Botanical Garden / Village,Summer,1 day,Eco / Cultural,"Environmental awareness programs, folk performances, and handicrafts."
Chapakharka,Chapakharka Highland Trek & Cultural Day,Kavre,3,Hill / Village,Autumn,1 day,Adventure / Cultural,Trekking with local folk performances and handicrafts.
Ryale,Ryale Village Cultural Festival,Kavre,3,Village Grounds,Spring,1 day,Cultural,"Folk music, dances, and handicraft stalls."
Mahendrajyoti,Mahendrajyoti Eco Trek & Cultural Day,Kavre,3,Hill / Trek Base,Summer,1 day,Eco / Cultural,"Trekking, folk performances, and environmental awareness."
Ugratara Janagal,Ugratara Janagal Temple Mela,Lalitpur,3,Temple Grounds,March,1 day,Religious / Cultural,Devotional rituals with folk music and handicrafts.
Nala Ugrachandi,Nala Ugrachandi Temple Festival,Kavre,3,Temple Grounds,April,1 day,Religious / Cultural,Pilgrimage rituals and folk performances.
Devitar,Devitar Highland Cultural Day,Lalitpur,3,Village Grounds,Spring,1 day,Cultural,"Folk music, dances, and handicrafts."
Nakhipot,Nakhipot Village Cultural Festival,Lalitpur,3,Village / Square,Autumn,1 day,Cultural,Folk performances and handicraft exhibitions.
Madhyapur Thimi,Thimi Pottery & Cultural Week,Bhaktapur,3,Village / Square,Spring,2 days,Cultural / Tourism,"Pottery demonstrations, folk music, and handicraft exhibitions."
Mulpani,Mulpani Highland Eco & Cultural Day,Kathmandu,3,Hill / Village Grounds,Summer,1 day,Eco / Cultural,"Trekking, environmental awareness, and folk performances."
Nayapati,Nayapati Village Festival,Lalitpur,3,Village Grounds,Autumn,1 day,Cultural,"Folk music, dances, and handicraft exhibitions."
Aalapot,Aalapot Eco & Cultural Trek,Kavre,3,Hill / Trek Base,Spring,1 day,Eco / Adventure,"Trekking, folk performances, and environmental awareness."
Mulkharka,Mulkharka Village Cultural Festival,Kavre,3,Village Grounds,Autumn,1 day,Cultural,"Folk performances, music, and handicrafts."
Dhunche,Dhunche Highland Eco & Cultural Festival,Rasuwa,3,Village / Trek Area,Summer,1 day,Eco / Cultural,"Trekking, folk performances, and environmental awareness."
Bharkhu,Bharkhu Village Cultural Day,Rasuwa,3,Village Grounds,Spring,1 day,Cultural,"Folk music, dances, and handicraft exhibitions."
Chandanbari,Chandanbari Highland Festival,Rasuwa,3,Hill / Village Grounds,Autumn,1 day,Cultural,Folk performances and handicraft stalls.
Mukharka,Mukharka Village Cultural Day,Rasuwa,3,Village Grounds,Spring,1 day,Cultural,"Folk music, dances, and local handicrafts."
Sherpagaon,Sherpagaon Cultural & Trekking Festival,Rasuwa,3,Trek / Village,Autumn,2 days,Adventure / Cultural,Trekking and Sherpa cultural performances.
Khangjim,Khangjim Highland Eco & Cultural Day,Rasuwa,3,Hill / Village Grounds,Summer,1 day,Eco / Cultural,Folk performances and environmental awareness.
Bhalche,Bhalche Village Cultural Festival,Rasuwa,3,Village Grounds,Autumn,1 day,Cultural,"Folk music, dances, and handicraft stalls."
Fikuri,Fikuri Highland Trek & Cultural Day,Rasuwa,3,Trek / Village,Spring,1 day,Adventure / Cultural,Trekking and folk performances.
Archale,Archale Village Cultural Festival,Kavre,3,Village Grounds,Autumn,1 day,Cultural,"Folk performances, music, and handicrafts."
Laharepauwa,Laharepauwa Highland Festival,Kavre,3,Hill / Village Grounds,Summer,1 day,Cultural,"Folk music, dances, and handicraft exhibitions."
Kumpur,Kumpur Eco & Cultural Trek,Kavre,3,Hill / Trek Base,Spring,1 day,Eco / Adventure,"Trekking, folk performances, and environmental awareness."
Adamtar,Adamtar Village Cultural Day,Kavre,3,Village Grounds,Autumn,1 day,Cultural,"Folk music, dances, and handicrafts."
Belinitar,Belinitar Highland Eco & Cultural Day,Kavre,3,Hill / Village,Summer,1 day,Eco / Cultural,"Trekking, folk performances, and environmental awareness."
Bhutiya,Bhutiya Village Cultural Festival,Kavre,3,Village Grounds,Spring,1 day,Cultural,"Folk music, dances, and handicraft stalls."
Taruka,Taruka Highland Cultural Day,Kavre,3,Hill / Village Grounds,Autumn,1 day,Cultural,Folk performances and handicraft exhibitions.
Gorsyang,Gorsyang Village Festival,Kavre,3,Village Grounds,Summer,1 day,Cultural,"Folk music, dances, and handicraft stalls."
Charghare,Charghare Highland Festival,Kavre,3,Hill / Village,Spring,1 day,Cultural,Folk performances and handicraft exhibitions.
Gerkhu,Gerkhu Eco & Cultural Trek,Kavre,3,Hill / Trek Base,Summer,1 day,Eco / Cultural,"Trekking, folk performances, and environmental awareness."
Haldekalika,Haldekalika Temple Mela,Lalitpur,3,Temple Grounds,March,1 day,Religious / Cultural,Devotional rituals and folk performances.
Hiramanitar,Hiramanitar Village Cultural Day,Lalitpur,3,Village Grounds,Autumn,1 day,Cultural,"Folk music, dances, and handicraft stalls."
Ramche,Ramche Highland Eco & Cultural Festival,Rasuwa,3,Hill / Village,Spring,1 day,Eco / Cultural,"Trekking, folk performances, and environmental awareness."
Thuman,Thuman Village Cultural Festival,Rasuwa,3,Village Grounds,Autumn,1 day,Cultural,"Folk music, dances, and handicrafts."
Rasua,Rasua Highland Eco & Cultural Trek,Rasuwa,3,Hill / Village,Summer,1 day,Eco / Adventure,"Trekking, folk performances, and environmental awareness."
Rasuwagadhi,Rasuwagadhi Fort Cultural Day,Rasuwa,3,Fort / Village Grounds,Autumn,1 day,Cultural / Historical,"Heritage tours, folk performances, and handicraft exhibitions."
Tempu-Helambu Trek,Tempu-Helambu Trek Cultural Festival,Sindhupalchok,3,Trek / Village,Spring,2 days,Adventure / Cultural,Trekking combined with local Sherpa & Tamang folk performances.
Chilime,Chilime Hydro & Cultural Day,Rasuwa,3,Hydro Plant Area,Summer,1 day,Eco / Cultural,"Folk music, dances, and environmental awareness."
Saramthali,Saramthali Highland Cultural Day,Rasuwa,3,Village Grounds,Autumn,1 day,Cultural,"Folk performances, handicrafts, and community gathering."
Doglang,Doglang Trek & Cultural Festival,Rasuwa,3,Trek Base / Village,Spring,2 days,Adventure / Cultural,Trekking with local folk performances and handicraft exhibitions.
Old Langtang Village,Langtang Heritage & Cultural Festival,Rasuwa,3,Village Grounds,Autumn,1 day,Cultural / Tourism,"Folk music, dances, and local handicrafts display."
Tsangbu Ri,Tsangbu Ri Trek & Eco Day,Rasuwa,3,Trek Base / Hill,Summer,1 day,Adventure / Eco,"Trekking, environmental awareness, and local folk programs."
Raksirang,Raksirang Highland Cultural Festival,Makwanpur,3,Village Grounds,Spring,1 day,Cultural,"Folk music, dances, and handicraft exhibitions."
Bharta Pundyadevi,Bharta Pundyadevi Eco & Cultural Day,Makwanpur,3,Village / Hill,Summer,1 day,Eco / Cultural,Folk performances combined with environmental awareness.
Gogane,Gogane Trekking & Cultural Festival,Kavre,3,Hill / Trek Base,Autumn,2 days,Adventure / Cultural,Trekking and local folk performances.
Agara,Agara Village Cultural Day,Rasuwa,3,Village Grounds,Spring,1 day,Cultural,"Folk music, dances, and handicraft exhibitions."
Tasarpu,Tasarpu Eco & Cultural Trek,Kavre,3,Hill / Village,Summer,1 day,Adventure / Eco,Trekking with folk performances and environmental awareness.
Kewalpur,Kewalpur Highland Cultural Festival,Rasuwa,3,Village Grounds,Autumn,1 day,Cultural,"Folk music, dances, and handicraft stalls."
Jeewanpur,Jeewanpur Village Festival,Kavre,3,Village Grounds,Spring,1 day,Cultural,"Folk performances, handicrafts, and community gathering."
Chhatre Deurali,Chhatre Deurali Trek & Cultural Day,Rasuwa,3,Trek / Village,Summer,1 day,Adventure / Cultural,Trekking with local folk performances and handicrafts.
Mudkhu,Mudkhu Highland Eco & Cultural Day,Rasuwa,3,Hill / Village Grounds,Autumn,1 day,Eco / Cultural,"Trekking, environmental awareness, and folk programs."
Okharpauwa,Okharpauwa Highland Trek & Festival,Nuwakot,3,Hill / Village,Spring,1 day,Adventure / Cultural,Trekking with folk performances and handicrafts.
Kakani,Kakani Eco & Cultural Trek,Nuwakot,3,Hill / Trek Base,Summer,1 day,Adventure / Eco,Trekking and local folk cultural performances.
Bhadratar,Bhadratar Village Cultural Day,Nuwakot,3,Village Grounds,Autumn,1 day,Cultural,"Folk music, dances, and handicraft stalls."
Kharanitar,Kharanitar Highland Cultural Festival,Nuwakot,3,Village / Hill,Spring,1 day,Cultural,Folk performances and handicraft exhibitions.
Likhu (generic),Likhu Valley Trek & Cultural Day,Ramechhap,3,Trek / Village,Summer,2 days,Adventure / Cultural,Trekking with folk performances and handicrafts.
Talakhu,Talakhu Highland Cultural Festival,Kavre,3,Village Grounds,Autumn,1 day,Cultural,"Folk music, dances, and handicraft exhibitions."
Gajuri,Gajuri Village Cultural & Eco Day,Dhading,3,Village Grounds / Hill,Spring,1 day,Eco / Cultural,Folk performances combined with environmental awareness.
Chuwabote Gaun,Chuwabote Highland Cultural Day,Rasuwa,3,Village Grounds,Summer,1 day,Cultural,"Folk music, dances, and handicraft exhibitions."
Jyamrung,Jyamrung Eco & Cultural Trek,Dhading,3,Hill / Village,Autumn,2 days,Adventure / Eco,Trekking and local folk performances.
Katunge,Katunge Village Cultural Festival,Kavre,3,Village Grounds,Spring,1 day,Cultural,"Folk music, dances, and handicraft stalls."
Gokarneshwor Temple,Gokarneshwor Temple Mela,Kathmandu,3,Temple Grounds,March,1 day,Religious / Cultural,"Devotional rituals, folk performances, and local stalls."
Tripureswor,Tripureswor Temple Festival,Kathmandu,3,Temple Grounds,April,1 day,Religious / Cultural,"Rituals, folk music, and community gathering."
Salyankot,Salyankot Highland Trek & Cultural Festival,Kavre,3,Hill / Village,Autumn,1 day,Adventure / Cultural,Trekking and local folk performances.
Mahavir,Mahavir Temple Mela,Kathmandu,3,Temple Grounds,March,1 day,Religious / Cultural,Devotional rituals with folk performances and local crafts.
Vharse Pokhari,Vharse Pokhari Eco & Cultural Day,Kavre,3,Pond / Hill Area,Summer,1 day,Eco / Cultural,Folk performances and environmental awareness.
Gangajamuna,Gangajamuna Highland Eco Festival,Dhading,3,Hill / Village,Spring,1 day,Eco / Cultural,"Trekking, folk music, and handicraft exhibitions."
Gumdi,Gumdi Village Cultural Day,Kavre,3,Village Grounds,Autumn,1 day,Cultural,Folk performances and handicraft stalls.
Khaniyanbas,Khaniyanbas Eco & Cultural Trek,Rasuwa,3,Hill / Village,Summer,1 day,Adventure / Eco,Trekking and local folk performances.
Satyadevi Mandir,Satyadevi Mandir Mela,Dhading,3,Temple Grounds,March,1 day,Religious / Cultural,Devotional rituals and folk performances.
Kintang,Kintang Highland Trek & Cultural Festival,Kavre,3,Hill / Village,Autumn,1 day,Adventure / Cultural,Trekking with folk performances and handicrafts.
Salme,Salme Village Cultural Festival,Dhading,3,Village Grounds,Spring,1 day,Cultural,Folk performances and handicraft exhibitions.
Bhalche,Bhalche Highland Eco & Cultural Day,Rasuwa,3,Hill / Village,Summer,1 day,Eco / Cultural,Trekking and folk performances.
Kaule,Kaule Highland Trek & Cultural Day,Rasuwa,3,Trek / Village,Autumn,1 day,Adventure / Cultural,Trekking with local folk performances.
Fikuri,Fikuri Village Cultural Festival,Rasuwa,3,Village Grounds,Spring,1 day,Cultural,"Folk music, dances, and handicrafts."
Jibjibe,Jibjibe Highland Eco & Cultural Day,Dhading,3,Hill / Village,Summer,1 day,Eco / Cultural,"Trekking, folk performances, and environmental awareness."
Bhorle,Bhorle Village Cultural Festival,Dhading,3,Village Grounds,Autumn,1 day,Cultural,"Folk music, dances, and handicraft exhibitions."
Jharlang,Jharlang Highland Cultural Festival,Rasuwa,3,Hill / Village Grounds,Spring,1 day,Cultural,Folk performances and handicraft stalls.
Hetauda,Hetauda Cultural & Eco Week,Makwanpur,3,Town Square / Hill,Summer,2 days,Cultural / Eco,"Folk performances, handicrafts, and environmental awareness programs."
Sukaura,Sukaura Highland Trek & Festival,Dhading,3,Hill / Trek Base,Autumn,1 day,Adventure / Cultural,Trekking and folk performances.
Lattaramveshwar Mahadev Temple,Lattaramveshwar Temple Mela,Dhading,3,Temple Grounds,March,1 day,Religious / Cultural,Devotional rituals and folk performances.
Ichankhu Narayan,Ichankhu Narayan Temple Festival,Kavre,3,Temple Grounds,April,1 day,Religious / Cultural,Rituals and folk performances.
Harnamadi,Harnamadi Village Cultural Day,Dhading,3,Village Grounds,Spring,1 day,Cultural,"Folk music, dances, and handicrafts."
Shreepur Chhatiwan,Shreepur Chhatiwan Eco & Cultural Day,Makwanpur,3,Hill / Village,Summer,1 day,Eco / Cultural,"Trekking, folk performances, and environmental awareness."
Gundu,Gundu Village Cultural Festival,Kavre,3,Village Grounds,Autumn,1 day,Cultural,"Folk music, dances, and handicrafts."
Manthali,Manthali Highland Cultural Day,Ramechhap,3,Village Grounds,Spring,1 day,Cultural,Folk performances and handicraft exhibitions.
Asrang,Asrang Eco & Cultural Trek,Ramechhap,3,Hill / Village,Summer,1 day,Adventure / Eco,Trekking and folk performances.
Chamere Cave,Chamere Cave Highland Festival,Ramechhap,3,Cave / Hill,Autumn,1 day,Adventure / Cultural,"Trekking, folk performances, and local handicrafts."
Gotikhel,Gotikhel Village Cultural Festival,Lalitpur,3,Village Grounds,Spring,1 day,Cultural,"Folk music, dances, and handicraft exhibitions."
Kaleshwor,Kaleshwor Mahadev Temple Mela,Kavre,3,Temple Grounds,March,1 day,Religious / Cultural,Devotional rituals with folk performances.
Chyamrang Besi,Chyamrang Besi Highland Trek & Cultural Day,Rasuwa,3,Trek / Village,Summer,1 day,Adventure / Cultural,Trekking and folk performances.
